Name,Region,Address,Contact,Curriculum
Kroot Memorial School,Karnataka,"Kroot Memorial School,Old Madras Road Hoskote, Bangalore, Bengaluru, Karnataka ","['080-27900192', '080-27932993']",ICSE
Sri Kumaran Public School,Karnataka,"Sri Kumaran Public School,Survey #44 To 48 Mallasandra Village Uttarahalli Hobli Bangalore, Bangalore South Taluk, Bengaluru, Karnataka - 560062 ","['080-22538105', '080-65839370']",ICSE
Lorven Public School,Karnataka,"Lorven Public School,#84/1 Chandapura Anekal Road, Bangalore, Bengaluru, Karnataka ","['080-2783370', '080-7835431']",ICSE
S. S. M. Public School,Karnataka,"S. S. M. Public School,8th Mile Tumkur Road Nagasandra Post, Bangalore, Bengaluru, Karnataka ",['080-28378130'],ICSE
Mahatma Vidyalaya,Karnataka,"Mahatma Vidyalaya,Muthanallur Anekal Tq, Bangalore, Bengaluru, Karnataka ",[''],ICSE
Maruthi Vidyalaya,Karnataka,"Maruthi Vidyalaya,#85/2 Horamavu Agara Bank Avenue Extension, Bangalore, Bengaluru, Karnataka ","['080-25603711', '080-25603721']",ICSE
Maxwell Public School,Karnataka,"Maxwell Public School,9th Main Hrbr-I Block Kalyan Nagar, Bangalore, Bengaluru, Karnataka - 560043 ","['080-25450822', '080-25452859']",ICSE
New Millennium School,Karnataka,"New Millennium School,Horamavu Agara, Bangalore, Bengaluru, Karnataka ","['080-65989755', '080-28445812']",ICSE
Mount Senoria School,Karnataka,"Mount Senoria School,#82 Swathantra Yodhara Nagar Bangalore, Laggere, Bengaluru, Karnataka - 560058 ",['080-23720500'],ICSE
R.N.S. Vidyaniketan,Karnataka,"R.N.S. Vidyaniketan,324 Bunts'sangha Complex Chord Road Bangalore, Vijayanagar, Bengaluru, Karnataka ","['080-23397666', '080-23398922']",ICSE
R. T. Nagar Public School,Karnataka,"R. T. Nagar Public School,I Main ' A ' Cross Kanakanagar R. T. Nagar Post Post Box #3226, Bangalore, Bengaluru, Karnataka ","['080-23542040', '080-23535282']",ICSE
Sarvodaya National Public School,Karnataka,"Sarvodaya National Public School,#12 10th Main Binny Layout Nagarabhavi Road Bangalore, Vijayanagar, Bengaluru, Karnataka ","['080-23303772', '080-2350790']",ICSE
National Public School,Karnataka,"National Public School,Igglur Near Surya City Anekal Taluk, Bangalore, Bengaluru, Karnataka - 560099 ",['080-7801684'],ICSE
Nazareth School,Karnataka,"Nazareth School,Old Chandapura Hosur Main Road Bangalore, Anekal Taluk, Bengaluru, Karnataka ",['09242641178'],ICSE
Vidya Niketan School,Karnataka,"Vidya Niketan School,#30 Kempapura Bangalore, Hebbal, Bengaluru, Karnataka - 560024 ","['080-23620454', '080-23531340']",ICSE
Outreach School,Karnataka,"Outreach School,24/1-1 B. T. S. Road Wilson Garden Extn, Bangalore, Bengaluru, Karnataka ","['080-41506103', '080-41633655']",ICSE
Oxford Public School,Karnataka,"Oxford Public School,#1 Srikantapura Nagasandra Post, Bangalore, Bengaluru, Karnataka ",['09945622240'],ICSE
St. Vincent Pallotti School,Karnataka,"St. Vincent Pallotti School,Babusahib Palya, Bangalore, Bengaluru, Karnataka ","['080-25603768', '080-49535226']",ICSE
Patel Public School,Karnataka,"Patel Public School,Subbaihna Palya, Bangalore, Bengaluru, Karnataka ",['080-25450466'],ICSE
St. Peter's School,Karnataka,"St. Peter's School,Survey #56 & 58 Kaikondrahalli Before Wipro Campus Bangalore, Sarjapura Road, Bengaluru, Karnataka ","['080-65688671', '080-65688671']",ICSE
St. Thomas Public School,Karnataka,"St. Thomas Public School,32 Church Road New Thippasandra Bangalore, Indira Nagar, Bengaluru, Karnataka ",['080-25282890'],ICSE
Sri Vani Public School,Karnataka,"Sri Vani Public School,1246 II Stage Bangalore, Rajaji Nagar, Bengaluru, Karnataka ","['080-23322239', '080-23328801']",ICSE
Rashtreeya Vidyalaya Public School,Karnataka,"Rashtreeya Vidyalaya Public School,Rashtreeya Vidyalaya Road Near Lalbagh West Gate Bangalore, Visweswarapuram, Bengaluru, Karnataka ",['080-26569588'],ICSE
Seshadripuram Public School,Karnataka,"Seshadripuram Public School,Mother Dairy Road Bangalore, Yelahanka New Town, Bengaluru, Karnataka ","['080-22955376', '080-22955384']",ICSE
The Regency Public School,Karnataka,"The Regency Public School,5/1 A. M. S. Extension Vidyaranyapura, Bangalore, Bengaluru, Karnataka ","['080-23642370', '080-64502511']",ICSE
Vinayaka Public School,Karnataka,"Vinayaka Public School,1st Main Vinayakanagar Bagalur Cross I. A. F. Post Bangalore, Yelahanka, Bengaluru, Karnataka ","['080-28478544', '080-32484050']",ICSE
Vijayashree Public School,Karnataka,"Vijayashree Public School,Opposite Mei Layout Mallasandra, Bangalore, Bengaluru, Karnataka ",['080-28399899'],ICSE
Triveni Public School,Karnataka,"Triveni Public School,S. #39 Hesaraghatta Main Road Nagasandra P. O. Bangalore, Bagalagunte, Bengaluru, Karnataka ","['080-23721148', '080-28397648']",ICSE
Sharada Vidyalaya Public School,Karnataka,"Sharada Vidyalaya Public School,#12/2 Nagasandra Post T. G. Hally, Bangalore, Bengaluru, Karnataka ","['080-32543101', '080-23724211']",ICSE
Vidya Soudha Public School,Karnataka,"Vidya Soudha Public School,#9/1 1st Main 1st Stage Peenya Bangalore, Bengaluru, Karnataka ","['918028393344', '08028391219']",ICSE
Sree Rama Vidyalaya,Karnataka,"Sree Rama Vidyalaya,9th Main 2nd Block Bangalore, Jaya Nagar, Bengaluru, Karnataka - 560011 ","['080-64501589', '080-64501588']",ICSE
Twinklers School,Karnataka,"Twinklers School,605 15th Cross 6th Phase J. P. Nagar Bangalore, J.p. Nagar, Bengaluru, Karnataka ","['080-26646779', '080-28433129']",ICSE
School Vivekananda,Karnataka,"School Vivekananda,Rajivgandhi Nagar Nti Layout Sahakarnagar Bangalore, Sahakaranagar, Bengaluru, Karnataka ","['9900049196', '9900049195']",ICSE
Swargarani School,Karnataka,"Swargarani School,B. E. M. L. Layout Bangalore, Rajarajeshwari Nagar, Bengaluru, Karnataka ","['080-28616826', '080-28616115']",ICSE
Shantiniketan Trust School,Karnataka,"Shantiniketan Trust School,#70 Bilekahalli, Bangalore, Bengaluru, Karnataka ","['080-26484762', '080-26484164']",ICSE
Silicon Valley School,Karnataka,"Silicon Valley School,' C ' Block Sahakaranagar, Bangalore, Bengaluru, Karnataka ","['080-23637260', '09343469226']",ICSE
Vishwa Vidyapeeth,Karnataka,"Vishwa Vidyapeeth,Survey #65 Singanayakanahalli Doddaballapur Road Yelahanka North, Bangalore, Bengaluru, Karnataka ","['23095606', '9845053065']",ICSE
St. Francis Icse School,Karnataka,"St. Francis Icse School,Balarapatna Ramasamundra Chamarajanagar Chamrajanagar-571 342, Chamarajanagar, Karnataka ",['08226-224715'],ICSE
Gem International Residential School,Karnataka,"Gem International Residential School,Bevenhalli, Alipur Post, Chikbalapur District, Near Bangaluru, Gauribidanur Taluk, Chikkaballapur, Karnataka - 561213 ",['ka215cisce.org'],ICSE
Shantha Vidyaniketan,Karnataka,"Shantha Vidyaniketan,Peresandra Cross Peresandra Village Chikballapur, Chickballapur, Chikkaballapur, Karnataka - 562104 ",['7259233555'],ICSE
St. ANN's School,Karnataka,"St. ANN's School,Gauribidanur Madanahalli B. H. Road rict Chikballapur-561 208, Kolar Dist, Chikkaballapur, Karnataka ","['08155-292673', '08155-285735']",ICSE
Vidyanidhi Public School,Karnataka,"Vidyanidhi Public School,B. H. Road Gauribidanur Chikballapur-561 208, Gauribidanur Taluk, Chikkaballapur, Karnataka - 561208 ","['08155-285444', '08155-286685']",ICSE
St. Mary's International School,Karnataka,"St. Mary's International School,Undedasarahalli Uppalli Village Indavara P.O, Indavara Post, Chikkamagaluru, Karnataka - 577101 ","['+91 8262-228402', '228403']",ICSE
Amber Valley Residential School,Karnataka,"Amber Valley Residential School,P. O. Box #116 K. M. Road Chickmagalur, Mugthihalli, Chikmagalur, Karnataka ","['08262-224535', '08262-224633']",ICSE
Infant Jesus School,Karnataka,"Infant Jesus School,Kadri-Midri Mugthihalli Post Chickmagalur, Chikmagalur, Karnataka ",['08262-224231'],ICSE
Kuvempu Vidyaniketan,Karnataka,"Kuvempu Vidyaniketan,Kadrimidri Able Hobli Rampura Post, Chickmagalur, Chikmagalur, Karnataka ",['2004'],ICSE
Nazareth School,Karnataka,"Nazareth School,Banakal Post Mudigere Taluk Chickmagalur, Chikmagalur, Karnataka ",['08263-216226'],ICSE
Prajna Central School,Karnataka,"Prajna Central School,NH-206 Chickmagalur, Kadur, Chikmagalur, Karnataka ",['08267-214248'],ICSE
Don Bosco School,Karnataka,"Don Bosco School,P. B. #64 N. H. 4 Road, Kelagote, Chitradurga, Karnataka - 577501 ","['08194-234804', '08194-234656', '08194-235995']",ICSE
St. Theresa's School,Karnataka,"St. Theresa's School,Bendur, Mangalore, Dakshina Kannada, Karnataka - 575002 ",['0824-2214278'],ICSE
Sri Taralabalu School,Karnataka,"Sri Taralabalu School,Anubhavamantapa P. B. #303 -577 004, Davangere, Davanagere, Karnataka ","['08192-222270', '08192-220017']",ICSE
Oriental Primary and High School,Karnataka,"Oriental Primary and High School,Mcl Road Gokul Road, Hubli, Dharwad, Karnataka - 580030 ",['0836-2236009'],ICSE
Parivarthan Elite English Medium School,Karnataka,"Parivarthan Elite English Medium School,Ganjikatti Road Taluk : Kalaghatgi District, Mishrikoti, Dharwad, Karnataka - 581226 ","['08370283504', '08370283502']",ICSE
Parivarthan Gurukul Heritage English Medium School,Karnataka,"Parivarthan Gurukul Heritage English Medium School,Akshay Nagar ( Gokul Road ), Hubli, Dharwad, Karnataka - 580030 ","['09902263922', '09908849422']",ICSE
Vinay Chikkatti School,Karnataka,"Vinay Chikkatti School,Near Adavisomapur Mundargi Road Gadag, Gadag, Karnataka - 582101 ","['08372218838', '+919448007467']",ICSE
Sayyid Akbar Husayni School,Karnataka,"Sayyid Akbar Husayni School,Khaja Bandanawaz Marg Near Dargah Rauza-E-Buzurg, Gulbarga, Karnataka - 585104 ",['08472-223939'],ICSE
Anantha International School,Karnataka,"Anantha International School,Ananthasadana Laxmipura, Arsikere, Hassan, Karnataka - 573103 ",['ka183cisce.org'],ICSE
Podar International School,Karnataka,"Podar International School,#32 & 33 Kiadb Industrial Area, Kasaba Hubli, Hassan, Karnataka ",['1927'],ICSE
Shri Vivekananda Public School,Karnataka,"Shri Vivekananda Public School,Raghavendra Saw Mill Road Gayathri Extension, Channarayapatna, Hassan, Karnataka - 573116 ","['9481543795', '9964830044']",ICSE
Rainbow Residential Public School,Karnataka,"Rainbow Residential Public School,P. B. #63 N. H. - 4 P. B. Road Kamadod, Ranebennur, Haveri, Karnataka - 581115 ","['08453005046', '08453005045']",ICSE
Coorg Public School,Karnataka,"Coorg Public School,Post Box #14 Gonikoppal, S. Kodagu, Kodagu, Karnataka - 571213 ","['08274-247011', '08274-247881']",ICSE
General Thimmaiah Public School,Karnataka,"General Thimmaiah Public School,Shree Omkareshwara Temple Road, Madikeri, Kodagu, Karnataka - 571201 ",['08272-224830'],ICSE
Karaumbiah's Academy For Learning and Sports,Karnataka,"Karaumbiah's Academy For Learning and Sports,87/2 Kaikeri Gonikoppal, South Coorg, Kodagu, Karnataka - 571213 ","['08274-279456', '08274-279457']",ICSE
American Friendship Residential School,Karnataka,"American Friendship Residential School,P. O. Gudibanda, Renumakalahalli, Kolar, Karnataka - 561209 ","['08156-261016', '080-25280597']",ICSE
Christ International School,Karnataka,"Christ International School,Alambady Malur District, Kolar District, Kolar, Karnataka - 563130 ",['ka218cisce.org'],ICSE
Gnana Jyothi School,Karnataka,"Gnana Jyothi School,NH-4 M. I. T. C. Colony V. Guttahalli, Mulbagal, Kolar, Karnataka - 563131 ","['09242613860', '09449218508']",ICSE
Greencity International School,Karnataka,"Greencity International School,Hosur Road, Malur, Kolar, Karnataka - 563130 ","['9448789080', '9482766608']",ICSE
Jyothi English Medium School,Karnataka,"Jyothi English Medium School,P. O. Box #34, Chintamani, Kolar, Karnataka - 563125 ",['08154-290584'],ICSE
Prem Seva Vidyalaya,Karnataka,"Prem Seva Vidyalaya,Prem Seva Nagar 1 Endrikayapura, Narasapura Malur Road, Kolar, Karnataka - 653133 ","['08152-210487', '08152-291164']",ICSE
Sri K. V. English School,Karnataka,"Sri K. V. English School,C. V. V. Campus, Chickballapur, Kolar, Karnataka - 562101 ","['08156-263070', '08156-309582']",ICSE
Sri R.V. School,Karnataka,"Sri R.V. School,R. V. Garden P. C. Hally NH-4 Bypass, Kolar, Karnataka - 563101 ",['08152-222971'],ICSE
Sri Venu Central School,Karnataka,"Sri Venu Central School,Unikili Kasaba Hobli, Srinivaspur, Kolar, Karnataka - 563135 ","['08157-245265', '09972328125']",ICSE
Suguna International School,Karnataka,"Suguna International School,Near Deepthi Mahal Bangalore-Chennai National Highway Kolar, Kolar, Karnataka - 563101 ","['9353046808', '9353046812']",ICSE
Vidya Jyothi School,Karnataka,"Vidya Jyothi School,Basavanatha, Kolar, Karnataka - 563101 ",['08152-290746'],ICSE
R.V.S.R. Central School,Karnataka,"R.V.S.R. Central School,Survey #57/a Marlanahalli, Gangavathi Taluk, Koppal, Karnataka - 583229 ","['08533-283127', '08533-283128']",ICSE
S. F. S. Primary School,Karnataka,"S. F. S. Primary School,Hospet Road, Koppal, Karnataka - 583231 ","['08539225026', '08539225027']",ICSE
Sapthagiri Public School,Karnataka,"Sapthagiri Public School,Road Vaddarahatti, Gangavathi, Koppal, Karnataka - 583227 ",['08533-271113'],ICSE
Athreya Public School,Karnataka,"Athreya Public School,8th Cross V. V. Nagar, Mandya, Karnataka - 571401 ",['08232-223535'],ICSE
BGS Model Public School,Karnataka,"BGS Model Public School,Sasyakashi, Nagamangala, Mandya, Mandya, Karnataka - 571448 ",['www.bgsmps.in'],ICSE
Cauvery Public School,Karnataka,"Cauvery Public School,P. B. #47 Tubinakere Jakkanally Road Ragimuddanahalli Kothathi Hobali, Elechakanahalli Post, Mandya, Karnataka - 571401 ","['08232-219135', '08232-219136']",ICSE
De Paul International Residential School and Junior College,Karnataka,"De Paul International Residential School and Junior College,Avverahalli Belagola P. O. Srirangapatna, Srirangapatna Taluk, Mandya, Karnataka - 571606 ",['www.dpirs.org'],ICSE
Gnanodaya Public School,Karnataka,"Gnanodaya Public School,#413/4 Belawadi Naguvanahalli Post, Srirangapatna Taluk, Mandya, Karnataka - 571438 ","['08236-292692', '08236-292694']",ICSE
Jyothi Nivas School,Karnataka,"Jyothi Nivas School,Cauvery Extension Srirangapatna, Mandya, Karnataka - 571438 ","['09845277992', '09480382798']",ICSE
Santhome Public School,Karnataka,"Santhome Public School,Kyatamgere Bannur Road Kiragandur ( P. O. ), Mandya, Karnataka - 571403 ","['08232-219124', '08232-220200']",ICSE
Acharya Vidya Kula,Karnataka,"Acharya Vidya Kula,Aloka Road Left Fork Off Madikeri Highway 12 K. M. Stone, 12 K.m. Stone, Mysore, Karnataka - 571130 ",['0821-2402150'],ICSE
Adhyayan School,Karnataka,"Adhyayan School,Ca-02 Adishakthi Road Shakthinagar, Mysore, Karnataka - 570019 ","['0821-2476147', '09342241211']",ICSE
Flos Carmeli Convent School,Karnataka,"Flos Carmeli Convent School,#480 Old Kesare Village, Na, Mysore, Karnataka - 570003 ","['0821-2491006', '0821-2491002']",ICSE
Jnanasarovara International Residential School,Karnataka,"Jnanasarovara International Residential School,Parshuramanagar, Bhugathanahalli, Vajamangala Post, Bannur Road, Mysore, Karnataka - 570028 ",['ka109cisce.org'],ICSE
Mysore Public School,Karnataka,"Mysore Public School,H. D. Kote Road Rayanakere Post, Mysore, Karnataka - 570008 ","['0821-2597917', '0821-2597957']",ICSE
Nalanda Gurukula International,Karnataka,"Nalanda Gurukula International,Guddenahalli Koppa Post, Periyapatna Taluk, Mysore, Karnataka - 571104 ",['08223-258253'],ICSE
Notre Dame School,Karnataka,"Notre Dame School,Vijayanagar Iv Stage Hunsur Road, Hinkal, Mysore, Karnataka - 570017 ",['0821-2402856'],ICSE
Shree Mahaveer Jain Vidyalaya,Karnataka,"Shree Mahaveer Jain Vidyalaya,# C. A-01 Siddartha Layout Mysore, Mysore, Karnataka - 570011 ",['08212475247'],ICSE
Daffodils Concept School,Karnataka,"Daffodils Concept School,Gangavati Road Hosahalli ( E. J. ) Cross, Tq. Sindhanur, Raichur, Karnataka - 584128 ",['08535-200238'],ICSE
Akshara Residential School,Karnataka,"Akshara Residential School,Kalenahalli Cross P. B. #09, Shikaripura, Shimoga, Karnataka - 577427 ","['08187-290279', '08187-290810']",ICSE
National Residential School,Karnataka,"National Residential School,Thirthahalli Taluk, Konandoor, Shimoga, Karnataka - 577422 ","['08181-796344', '08185-551102']",ICSE
Radhakrishna Public School,Karnataka,"Radhakrishna Public School,#67/2 Varadahalli Road, Sagar, Shimoga, Karnataka - 577401 ",['08183-236228'],ICSE
Sahyadri School,Karnataka,"Sahyadri School,Yadehalli Bettamakki Seebinakere Post Thirthalli Tq, Thirthalli Tq., Shimoga, Karnataka - 577432 ",['08181-228810'],ICSE
St. Joseph's Aksharadhama,Karnataka,"St. Joseph's Aksharadhama,Sagar Road Gadikoppa, Shimoga, Karnataka - 577205 ","['09743094064', '09686124121']",ICSE
Bhoomi Public School,Karnataka,"Bhoomi Public School,Nh-206 Herur, Gubbi, Tumkur, Karnataka - 572216 ",[''],ICSE
Bishop Sargant School,Karnataka,"Bishop Sargant School,C. S. I. V. C. Campus B. H. Road, B.h. Road, Tumkur, Karnataka - 572102 ",['0816-2252092'],ICSE
Kunigal Valley International Residential School,Karnataka,"Kunigal Valley International Residential School,Gottikere B. M. Road, Kunigal, Tumkur, Karnataka - 572130 ",['08132-292391'],ICSE
The Presidency Public School,Karnataka,"The Presidency Public School,42/1 Jyothi Nagar Gurukula Extension Amarapura Road, Sira, Tumkur, Karnataka - 572137 ","['08135-277961', '08135-235366']",ICSE
Varin International Residential School,Karnataka,"Varin International Residential School,Doddahosur Kunigal Road Gulur Post, Tumkur, Karnataka - 572118 ",['ka159cisce.org'],ICSE
Green Park Central School,Karnataka,"Green Park Central School,Hiriadka, Udupi, Karnataka - 576113 ",['0820-2542404'],ICSE
Sharada Residential School,Karnataka,"Sharada Residential School,Kunjibettu, Udupi, Karnataka - 576102 ","['0820-2523129', '0820-2534991']",ICSE
Trinity Central School,Karnataka,"Trinity Central School,Perampalli Shivally Village, Manipal, Udupi, Karnataka - 576102 ",['0820-2572525'],ICSE
Vidyaniketan Public School,Karnataka,"Vidyaniketan Public School,Kaup, Udupi, Karnataka - 574106 ","['0820-2552253', '0820-2579216']",ICSE
Vidyodaya Public School,Karnataka,"Vidyodaya Public School,Vadiraja Road, Udupi, Karnataka - 576101 ","['0820-2531021', '0820-252055']",ICSE
New Shams School,Karnataka,"New Shams School,Post Box #20 Syed Ali Campus, Bhatkal, Uttara Kannada, Karnataka - 581320 ","['9296200448', '9731751287']",ICSE
Vidyanjali Public School,Karnataka,"Vidyanjali Public School,Ayodhya Nagar Sagar Road, Bhatkal, Uttara Kannada, Karnataka - 581320 ",['08385-222207'],ICSE
Bishop Moore Vidyapith,Kerala,"Bishop Moore Vidyapith, Kayamkulam,Kayamkulam, Alappuzha, Kerala - 690502 ",['+91 (479) 2442222 +91 (479) 2441776'],ICSE
Bishop Moore Vidyapith,Kerala,"Bishop Moore Vidyapith, Mavelikara,Kallumala P. O., Mavelikara, Alappuzha, Kerala - 690110 ",['www.bmvm.edu.in/'],ICSE
Carmel International School,Kerala,"Carmel International School,Punnapra, Alappuzha, Kerala ",['ke131cisce.org'],ICSE
Holy Angels Residential School,Kerala,"Holy Angels Residential School,Aroor P. O., Cherthala, Alappuzha, Kerala - 688534 ",['0478-2876336'],ICSE
Infant Jesus English Medium School,Kerala,"Infant Jesus English Medium School,Mavelikkara, Alappuzha, Kerala - 690101 ","['0479-2303011', '+91-9446117019']",ICSE
K. E. Carmel School,Kerala,"K. E. Carmel School,Pulincunnoo, Alappuzha, Kerala - 688504 ",['0477-2704067'],ICSE
Mathews Mar Athanasius Residential School,Kerala,"Mathews Mar Athanasius Residential School,P. O. Angadical, Chengannur, Alappuzha, Kerala - 689122 ","['0479-2469234', '0479-2468979']",ICSE
Our Lady of Mercy School,Kerala,"Our Lady of Mercy School,Aroor, Alappuzha, Kerala - 688534 ",['0478-2875017'],ICSE
St. ANN's Public School,Kerala,"St. ANN's Public School,Cherthala, Alappuzha, Kerala - 688524 ","['0478-2811279', '0478-3956641']",ICSE
St. John's English Medium School,Kerala,"St. John's English Medium School,Mattom, Mavelikkara, Alappuzha, Kerala - 690103 ","['0479-3092042', '0479-2302126']",ICSE
St. John's School,Kerala,"St. John's School,Peringala P. O., Kayamkulam, Alappuzha, Kerala - 690559 ","['0479-2442287', '0479-2445338']",ICSE
St. Joseph Public School,Kerala,"St. Joseph Public School,Pattanakad P. O., Cherthala, Alappuzha, Kerala - 688531 ",['0478-2594439'],ICSE
St. Joseph's Convent English Medium School,Kerala,"St. Joseph's Convent English Medium School,Parayamkulam L. S. P. O, Alappuzha, Kerala - 690071 ",['0479-2382121'],ICSE
St. Joseph's English Medium School,Kerala,"St. Joseph's English Medium School,Cheriyanad, Alappuzha, Kerala - 689511 ","['0479-2360581', '0479-2360404']",ICSE
Anita Public School,Kerala,"Anita Public School,Thannipuzha Okkal, Ernakulam, Kerala - 683550 ","['0484-2462795', '0484-6456279']",ICSE
Auxilium English Medium School,Kerala,"Auxilium English Medium School,Binny Road Palluruthy, Kochi, Ernakulam, Kerala - 682006 ",['0484-2238722'],ICSE
Carmel English Medium School,Kerala,"Carmel English Medium School,Ochanthuruth P. O. Valappu, Kochi, Ernakulam, Kerala - 682508 ",['0484-2493014'],ICSE
Chavara International Academy,Kerala,"Chavara International Academy,Muvattupuzha, Vazhakulam, Ernakulam, Kerala - 686670 ","['91-9656581717', '0485-2260080']",ICSE
Don Bosco Central School,Kerala,"Don Bosco Central School,Bosco Nagar, Angamaly, Ernakulam, Kerala - 683572 ","['0484-2453018', '0484-2453218']",ICSE
Don Bosco Senior Secondary School,Kerala,"Don Bosco Senior Secondary School,Vaduthala, Kochi, Ernakulam, Kerala - 682023 ","['0484-2205129', '0484-2436602']",ICSE
Jeevass Cmi Central School,Kerala,"Jeevass Cmi Central School,Railway Station Road Near Railway Station, Ernakulam, Kerala - 683101 ",['91-484-2984770'],ICSE
Jnanodaya Central School,Kerala,"Jnanodaya Central School,Chengal Kalady, Ernakulam, Kerala - 683574 ","['0484-2699077', '0484-3225271']",ICSE
Jyothis Central School,Kerala,"Jyothis Central School,Manjapra P. O, Ernakulam, Kerala - 683581 ",['0484-2690716'],ICSE
M. E. S. Udyogamandal School,Kerala,"M. E. S. Udyogamandal School,F. A. C. T. Town Ship P. O. Udyogamandal, Kochi, Ernakulam, Kerala - 683501 ","['0484-2551214', '0484-2553214']",ICSE
Mar Athanasius International School,Kerala,"Mar Athanasius International School,Kothamangalam College P. O. rict, Ernakulam Dist, Ernakulam, Kerala - 686666 ","['0485-2826198', '0485-2825022']",ICSE
Mary Ward English Medium School,Kerala,"Mary Ward English Medium School,Puthenvelikara, Ernakulam, Kerala - 683594 ",['0484-2487862'],ICSE
Matha Nagar Public School,Kerala,"Matha Nagar Public School,Gandhi Nagar, Kochi, Ernakulam, Kerala - 682017 ",['0484-2205129'],ICSE
Mount Tabor Residential Central School,Kerala,"Mount Tabor Residential Central School,Kalamassery, Kochi, Ernakulam, Kerala - 682033 ",['0484-2541023'],ICSE
Presidency Central School,Kerala,"Presidency Central School,Mudavoor P. O., Muvattupuzha, Ernakulam, Kerala - 686669 ",['0485-2813404'],ICSE
Rani Matha Public School,Kerala,"Rani Matha Public School,Flower Junction Jews Street, Ernakulam, Kerala - 682035 ",['0484-2360366'],ICSE
Santhi Vidyalaya,Kerala,"Santhi Vidyalaya,Edakochi Kochi Ernakulam, Ernakulam, Kerala - 682010 ",['04842327901'],ICSE
Santhome Central School,Kerala,"Santhome Central School,Mookkannoor P. O, Ernakulam, Kerala - 683577 ",['0484-2616945'],ICSE
Seventh Day Adventist High School,Kerala,"Seventh Day Adventist High School,Chammani Lane Kaloor, Kochi, Ernakulam, Kerala - 682017 ","['0484-2348685', '0484-2337664']",ICSE
St. Aloysius Convent I. S. C. School,Kerala,"St. Aloysius Convent I. S. C. School,P. O. Palluruthy, Kochi, Ernakulam, Kerala - 682006 ","['0484-2232726', '0484-2235753']",ICSE
Vimalagiri International School,Kerala,"Vimalagiri International School,Vazhappilly Mudavoor P. O., Muvattupuzha, Ernakulam, Kerala - 686669 ","['0485-2814460', '0485-2814350']",ICSE
Stella Maris Public School,Kerala,"Stella Maris Public School,Udayamperoor ( Old ), Ernakulam, Kerala - 682307 ","['0484-2792158', '0484-2791958']",ICSE
Matha Nagar Public School,Kerala,"Matha Nagar Public School,Gandhi Nagar, Kochi, Ernakulam, Kerala - 682017 ",['0484-2205129'],ICSE
Rani Matha Public School,Kerala,"Rani Matha Public School,Flower Junction Jews Street, Ernakulam, Kerala - 682035 ",['0484-2360366'],ICSE
Santhi Vidyalaya,Kerala,"Santhi Vidyalaya,Edakochi Kochi Ernakulam, Ernakulam, Kerala - 682010 ",['04842327901'],ICSE
Vidya Vikas School,Kerala,"Vidya Vikas School,Post Box #39 Vidya Nagar Karukadom P. O., Kothamangalam, Ernakulam, Kerala - 686691 ","['0485-2828621', '0485-2828622']",ICSE
Amalambika Convent English School,Kerala,"Amalambika Convent English School,Near Check Post, Thekkady, Idukki, Kerala ",['04869-223422'],ICSE
Auxilium School,Kerala,"Auxilium School,Salesian Sisters of Don Bosco, Kattappana, Idukki, Kerala - 685508 ",['04868-250710'],ICSE
S. D. A. English Residential High School,Kerala,"S. D. A. English Residential High School,East Junction Nedumkandam P. O, Idukki, Kerala - 685553 ",['04868-232121'],ICSE
St. Pius X English School,Kerala,"St. Pius X English School,P. O. Kuttikanam, Peermade, Idukki, Kerala - 685531 ",['04869-233537'],ICSE
Seventh-day Adventist English School,Kerala,"Seventh-day Adventist English School,Keezhur P. O., Iritty, Kannur, Kerala - 670703 ",['0490-2493830'],ICSE
Sreepuram English Medium High School & Junior College,Kerala,"Sreepuram English Medium High School & Junior College,Pallikunnu P. O, Kannur, Kerala - 670004 ","['0497-2711233', '0492-2701633']",ICSE
St. Anne's English Medium School,Kerala,"St. Anne's English Medium School,Payyavoor P. O., Na, Kannur, Kerala - 670633 ","['0460-2211515', '04602210217']",ICSE
St. Francis English Medium School,Kerala,"St. Francis English Medium School,Thottada P. O, Kannur, Kerala - 670007 ",['0497-2836612'],ICSE
Auxilium School,Kerala,"Auxilium School,Varakkad Kottamala Post Kasargod-671 314, Vellarikundu, Kasaragod, Kerala ","['0467-2245691', '0467-2241169']",ICSE
Green Woods Public School,Kerala,"Green Woods Public School,Green Woods Village A. K. Road P. O. Bekal Kasaragod Kasargod-671 318, Kasaragod, Kerala ","['0467-2239566', '0467-2265566']",ICSE
