Name,Region,Address,Contact,Curriculum
Vidya Vikasini School,Maharashtra,"Vidya Vikasini School,Gokhivare Vasai ( E ), Vasai (e), Thane, Maharashtra - 401208 ",['0250-2455295'],ICSE
Patkai Christian Academy,Manipur,"Patkai Christian Academy,Changraphung B. P. O. Shangshak S. O. Litan, S.o. Litan, Ukhrul, Manipur - 795145 ","['9856177537', '8414924091']",ICSE
Loreto Convent,Meghalaya,"Loreto Convent,Easr Khasi Hills, Shillong, East Khasi Hills, Meghalaya - 793003 ","['0364-2225559', '0364-2223139']",ICSE
Meghalaya Police Public School,Meghalaya,"Meghalaya Police Public School,P. T. S. Campus Golflinks Mawroh, Shillong, East Khasi Hills, Meghalaya - 793008 ",['0364-2591819'],ICSE
Pine Mount School,Meghalaya,"Pine Mount School,Shillong, East Khasi Hills, Meghalaya - 793001 ",['0364-2223039'],ICSE
Shillong Public School,Meghalaya,"Shillong Public School,Kenilworth Road Laitumkhrah, Shillong, East Khasi Hills, Meghalaya - 793003 ",['0364-2222354'],ICSE
St. Edmund's School,Meghalaya,"St. Edmund's School,Laitumkhrah, Shillong, East Khasi Hills, Meghalaya - 793003 ",['0364-2222307'],ICSE
Tura Public School,Meghalaya,"Tura Public School,Post Box #62, Tura, West Garo Hills, Meghalaya - 974001 ",['03651-223745'],ICSE
Jowai Public School,Meghalaya,"Jowai Public School,Jowai, West Jaintia Hills, Meghalaya - 793150 ",['03652-224145'],ICSE
Jubilee Memorial School,Nagaland,"Jubilee Memorial School,Salangtem Ward, Mokokchung, Nagaland - 798601 ",['0369-2226319'],ICSE
Amarvani School,Odisha,"Amarvani School,P. O. P. T. C. Turang, Orissa, Angul, Odisha - 759123 ",['06764-233166'],ICSE
Saint Lawrence School,Odisha,"Saint Lawrence School,P. O. Balramprasad Via Banarpal, Tentoloi, Angul, Odisha - 759128 ","['9861102183', '9861102183']",ICSE
Jaga Mata School,Odisha,"Jaga Mata School,Phapsi P. O. Ganpatrapali, Balangir, Odisha - 767032 ","['06655-250151', '06655-250931']",ICSE
Little Flower School,Odisha,"Little Flower School,Rajendra College P. O., Jyoti Nagar, Balangir, Odisha - 767002 ","['06652-250534', '06652-250698']",ICSE
St. Anne's School,Odisha,"St. Anne's School,Titligarh, Balangir, Odisha - 767033 ",['06655-220592'],ICSE
St. James' Convent School,Odisha,"St. James' Convent School,Panchughunta, Jaleswar, Balasore, Odisha - 756032 ",['06781-222339'],ICSE
St. Vincent's Convent School,Odisha,"St. Vincent's Convent School,Katcheri Road, Balasore, Odisha - 756001 ",['06782-262226'],ICSE
Carmel School,Odisha,"Carmel School,Ichhapur Dolasahi P. O., P.o. Bhadrak, Bhadrak, Odisha - 756127 ","['09437113289', '09337837111']",ICSE
Happy Home School,Odisha,"Happy Home School,P. O. Charampa, Bhadrak, Odisha - 756101 ",['06784-230789'],ICSE
Sunshine Mission School,Odisha,"Sunshine Mission School,Mission Compound, Bhadrak, Odisha - 756100 ",['06784-240726'],ICSE
Cambridge School,Odisha,"Cambridge School,Cantonment Road, Cuttack, Odisha - 753001 ","['0671-2301207', '0671-2301207']",ICSE
New Stewart School,Odisha,"New Stewart School,Mission Road P. O. Buxibazar, Cuttack, Odisha - 753001 ","['0671-2415808', '0671-2419368']",ICSE
Queen Mary's School,Odisha,"Queen Mary's School,Raja Bagicha, Cuttack, Odisha - 753009 ",['0671-2519293'],ICSE
S.C.B. Medical Public School,Odisha,"S.C.B. Medical Public School,S. C. B. Medical College Campus, Cuttack, Odisha - 753007 ",['0671-2414245'],ICSE
St. Antony's School,Odisha,"St. Antony's School,P. O. Naya Bazar, Bidyadharpur, Cuttack, Odisha - 753004 ",['0671-2441606'],ICSE
St. Joseph's Girls' High School,Odisha,"St. Joseph's Girls' High School,Cantonment Road, Cuttack, Odisha - 753001 ",['0671-2301307'],ICSE
St. Xavier's High School,Odisha,"St. Xavier's High School,Club House Gate, Barabati Stadium, Cuttack, Odisha - 753005 ",['0671-2302215'],ICSE
Stewart School,Odisha,"Stewart School,Mission Road, Cuttack, Odisha - 753001 ","['0671-2431890', '0671-2415808']",ICSE
Montfort School,Odisha,"Montfort School,Post Box #6, Dhenkanal, Odisha - 759001 ",['06762-224960'],ICSE
St. Joseph's English Medium School,Odisha,"St. Joseph's English Medium School,Dolo Tank Road Paralakhemundi, Gajapathi, Gajapati, Odisha - 761200 ",['06815-223585'],ICSE
Bidya Bhavan,Odisha,"Bidya Bhavan,Andhapasara Road Gosaninuagaon, Berhampur, Ganjam, Odisha - 760002 ",['0680-2260454'],ICSE
Carmel Convent School,Odisha,"Carmel Convent School,Chatrapur, Ganjam, Odisha - 761020 ",['06811-263038'],ICSE
De Paul School,Odisha,"De Paul School,Berhampur, Ganjam, Odisha - 760010 ",['0680-2291499'],ICSE
Guru Nanak Public School,Odisha,"Guru Nanak Public School,Giri Road, Berhampur, Ganjam, Odisha - 760005 ",['0680-3208200'],ICSE
Jayshree Chemicals School,Odisha,"Jayshree Chemicals School,P. O. Jayshree, Berhampur, Ganjam, Odisha - 761025 ","['06811-254319', '06811-254336']",ICSE
Matrusri Anglo Vedic School,Odisha,"Matrusri Anglo Vedic School,Hillpatna, Berhampur, Ganjam, Odisha - 760005 ",['0680-2205475'],ICSE
St. Joseph's Convent School,Odisha,"St. Joseph's Convent School,Church Road Berhampur, Ganjam, Odisha - 760001 ",['060-2220568'],ICSE
St. Vincent's School,Odisha,"St. Vincent's School,Gunjam, Berhampur, Ganjam, Odisha - 760001 ",['0680-2221465'],ICSE
Bethany Convent School,Odisha,"Bethany Convent School,Madhuban Jagatsinghapur-754 142, Pradip Port, Jagatsinghpur, Odisha - 754142 ",['06722-222397'],ICSE
St. Mary's School,Odisha,"St. Mary's School,P. O. Jajpur Road, Jajpur, Odisha - 755019 ",['06726-220393'],ICSE
Stewart School,Odisha,"Stewart School,Sukinda Chromite Mines Kalarangiatta P. O., Tata Steel, Jajpur, Odisha - 755028 ","['06726-268863', '09437886156']",ICSE
Belpahar English Medium School,Odisha,"Belpahar English Medium School,P. O., Belpahar, Jharsuguda, Odisha - 768218 ","['06645-250341', '06645-258597']",ICSE
Daniel Public School,Odisha,"Daniel Public School,Sastri Nagar, Brajarajnagar, Jharsuguda, Odisha - 768216 ","['06645-242204', '06645-242686']",ICSE
Siksha Niketan,Odisha,"Siksha Niketan,P. O. Brajarajnagar, Brajrajnagar, Jharsuguda, Odisha - 768216 ",['06645-242785'],ICSE
St. Mary's Higher Secondary School,Odisha,"St. Mary's Higher Secondary School,Jharsuguda, Odisha - 768203 ",['06645-272366'],ICSE
St. Thomas English School,Odisha,"St. Thomas English School,Kalamandir Road P. O. Jharsuguda, Jharsuguda, Odisha - 768202 ","['06645-273264', '06645-279374']",ICSE
The Assembly of God School,Odisha,"The Assembly of God School,Cox Colony, Jharsuguda, Odisha - 738201 ",['06645-272496'],ICSE
Vivekananda International School,Odisha,"Vivekananda International School,P. O., Belpahar, Jharsuguda, Odisha - 768218 ","['0876-33774307', '09437209933']",ICSE
Vimala Convent School,Odisha,"Vimala Convent School,Bhawani Patna, Kalahandi, Odisha - 766001 ",['06670-230296'],ICSE
Carmel English Medium School,Odisha,"Carmel English Medium School,At Narayani Temple Roadp. O. District, Phulbani, Kandhamal, Odisha - 762001 ","['06842-253811', '06842-201789']",ICSE
St. Joseph's School,Odisha,"St. Joseph's School,P. O. Tinimuhani, Kendrapara, Odisha - 754211 ","['06727-220123', '06727-221162']",ICSE
Nirmala Convent School,Odisha,"Nirmala Convent School,Keonjhar, Kendujhar, Odisha - 758001 ",['06766-255560'],ICSE
St Mary's School,Odisha,"St Mary's School,Barbil, Kendujhar, Odisha - 758035 ",['06767-275307'],ICSE
St. Teresa's School,Odisha,"St. Teresa's School,P. O., Joda, Kendujhar, Odisha - 758034 ",['06767-218283'],ICSE
Children's Centre of Integral Education,Odisha,"Children's Centre of Integral Education,A-10/1 Sri Aurobindo Vihar Behind Rto's Office P. O. Bhoi Nagar, Bhubaneshwar, Khordha, Odisha - 51022 ","['0674-2541372', '0674-2540018']",ICSE
Loyola School,Odisha,"Loyola School,P. O. East Coast Railway Colony Chandrasekharpur, Bhubaneswar, Khordha, Odisha - 751023 ","['0674-2300791', '0674-2300365']",ICSE
Mission School,Odisha,"Mission School,Khurda Road, Jatni, Khordha, Odisha - 752050 ",['0674-2490886'],ICSE
Ruchika High School,Odisha,"Ruchika High School,G-6 Ganga Nagar Unit-6, Bhubaneswar, Khordha, Odisha - 751001 ","['0674-2397327', '0674-2397830']",ICSE
S.D.A. High School,Odisha,"S.D.A. High School,Orissa, Khordha, Odisha - 752055 ",['06755-220668'],ICSE
Saint Arnold's School,Odisha,"Saint Arnold's School,Kalinga Vihar, Khordha, Odisha - 751019 ","['0674-2475053', '0674-2475672']",ICSE
St. Joseph's High School,Odisha,"St. Joseph's High School,Bhubaneswar, Khordha, Odisha - 751022 ",['0674-2391274'],ICSE
Stewart School,Odisha,"Stewart School,Unit 8, Bhubaneswar, Khordha, Odisha - 751012 ",['0674-2561467'],ICSE
Venkateswar English Medium School,Odisha,"Venkateswar English Medium School,Unit Iv, Bhubaneswar, Khordha, Odisha - 751001 ","['0674-2510014', '0674-6539991']",ICSE
Deepti Convent School,Odisha,"Deepti Convent School,Kundariguda Laichan Nayak Marg H. O. Jeypore, H.o. Jeypore, Koraput, Odisha - 764001 ",['06854-251003'],ICSE
Jeevan Jyothi Convent School,Odisha,"Jeevan Jyothi Convent School,Semiliguda, Koraput, Odisha - 764036 ","['06853-225158', '06853-225238']",ICSE
Public School,Odisha,"Public School,Jeypore, Koraput, Odisha - 764001 ","['06854-233310', '06854-240004']",ICSE
Public School,Odisha,"Public School,Sunabeda, Koraput, Odisha - 763001 ","['06853-220389', '06853-220068']",ICSE
Deepti Convent School,Odisha,"Deepti Convent School,At. Sambayaguda P. O. & District Malkangiri, Malkangiri, Odisha - 764045 ","['06861-230159', '06861-230519']",ICSE
Kerala Public School,Odisha,"Kerala Public School,Ichinda Road, Rairangpur, Mayurbhanj, Odisha - 757043 ","['06794-222518', '06794-223390']",ICSE
Loyola School,Odisha,"Loyola School,Sankhabhanga Laxmiposi P. O., Baripada, Mayurbhanj, Odisha - 757107 ",['07750960704'],ICSE
St. Anne's Convent School,Odisha,"St. Anne's Convent School,Baripada, Mayurbhanj, Odisha - 757001 ",['06792-253381'],ICSE
Vikash Convent School,Odisha,"Vikash Convent School,Karanjia, Mayurbhanj, Odisha - 757037 ",['06796-220312'],ICSE
Saheed Laxman Nayak Public School,Odisha,"Saheed Laxman Nayak Public School,At & P. O. Umerkote, Orissa, Nabarangpur, Odisha - 764073 ",['06866-270480'],ICSE
Navjyoti Vidyalaya,Odisha,"Navjyoti Vidyalaya,Khariar Road, Nuapada, Odisha - 766104 ",['06678-221709'],ICSE
Blessed Sacrament High School,Odisha,"Blessed Sacrament High School,Vip Road, Puri, Odisha - 752001 ",['06752-226314'],ICSE
Deepti Convent School,Odisha,"Deepti Convent School,Raniguda Farm P. O., Rayagada, Odisha - 765001 ","['06856224603', '06856222124']",ICSE
Divine Public School,Odisha,"Divine Public School,New Colony, Rayagada, Odisha - 765001 ",['06856-223318'],ICSE
New Life English Medium School,Odisha,"New Life English Medium School,Bissamcuttack, Rayagada, Odisha - 765019 ","['06863-247164', '06863-247505']",ICSE
Sacred Heart School,Odisha,"Sacred Heart School,Convent Road, Gautam Nagar, Raniguda Farm, Rayagada, Odisha ",['or023cisce.org'],ICSE
St. John's School,Odisha,"St. John's School,Vianney Nagar P. O. Dhankauda Sambalpur, Sambalpur, Odisha - 768006 ",[''],ICSE
St. Joseph's Convent Higher Secondary School,Odisha,"St. Joseph's Convent Higher Secondary School,Brooks Hill, Sambalpur, Odisha - 768001 ","['0663-2548439', '0663-2548916']",ICSE
St. Anne's Convent School,Odisha,"St. Anne's Convent School,Block Chowk Sonepur P. O, Subarnapur, Odisha - 767017 ",['06654-221118'],ICSE
Carmel School,Odisha,"Carmel School,Hamirpur Sundargarh-769 003, Rourkela, Sundergarh, Odisha - 769003 ",['0661-2643281'],ICSE
Chinmaya Vidyalaya (e. M.),Odisha,"Chinmaya Vidyalaya (e. M.),Chhend Colony Sundargarh-769 015, Rourkela, Sundergarh, Odisha ",['0661-2480970'],ICSE
City English School,Odisha,"City English School,Gandhi Road Sundargarh-769 001, Rourkela, Sundergarh, Odisha - 769001 ",['0661-2510960'],ICSE
Desouza's School,Odisha,"Desouza's School,Sector-2 Sundargarh-769 006, Rourkela, Sundergarh, Odisha - 769006 ",['0661-2600883'],ICSE
Guru Tegh Bahadur Public School,Odisha,"Guru Tegh Bahadur Public School,Sector 18 Sundargarh-769 003, Rourkela, Sundergarh, Odisha - 769003 ",['0661-2651200'],ICSE
Indo English School,Odisha,"Indo English School,Birsa Dahar Road Sundargarh-769 012, Rourkela, Sundergarh, Odisha ","['0661-2501141', '0661-2500568']",ICSE
Ispat E. M. School,Odisha,"Ispat E. M. School,Fertilizer Township Sector 22 Sundargarh-769 007, Rourkela, Sundergarh, Odisha ","['0661-2561374', '0661-2446615']",ICSE
Ispat English Medium School,Odisha,"Ispat English Medium School,Sector-20 Sundargarh-769 005, Rourkela, Sundergarh, Odisha - 769005 ",['0661-2644832'],ICSE
Loreto English School,Odisha,"Loreto English School,Plot #228/843 Panposh Road Sundargarh-769 004, Rourkela, Sundergarh, Odisha - 769004 ",['0661-2402333'],ICSE
Mar Gregorios Memorial English School,Odisha,"Mar Gregorios Memorial English School,P. O. Jhirpani Sundargarh-769 042, Rourkela, Sundergarh, Odisha ","['0661-2470933', '0661-2471988']",ICSE
Nirmala English School,Odisha,"Nirmala English School,P. O. Sundargarh-770 017, Rajgangpur, Sundergarh, Odisha - 770017 ","['06624-220270', '06624-221970']",ICSE
Pragati Public School,Odisha,"Pragati Public School,Fertilizer Town Sundargarh-769 007, Rourkela, Sundergarh, Odisha - 769007 ",['0661-2560425'],ICSE
Saint Mary's School,Odisha,"Saint Mary's School,Jagda Colony Sundargarh-769 042, Rourkela, Sundergarh, Odisha - 769042 ",['0661-2476837'],ICSE
Sri Aurobindo's Rourkela School,Odisha,"Sri Aurobindo's Rourkela School,Sector 5 Sundargarh-769 002, Rourkela, Sundergarh, Odisha - 769002 ","['0661-2642334', '0661-2647334']",ICSE
St. Gregorios English School,Odisha,"St. Gregorios English School,Beldihi P. O. Kalunga Sundargarh-769 031, Rourkela, Sundergarh, Odisha - 769031 ",['0661-2660175'],ICSE
St. John Mary Vianney English Medium School,Odisha,"St. John Mary Vianney English Medium School,P. O. Kutra Sundargarh-770 018, Kusumtoli, Sundergarh, Odisha - 770018 ",['06624-245019'],ICSE
St. Joseph's Convent School,Odisha,"St. Joseph's Convent School,Hamirpur Sundargarh-769 003, Rourkela, Sundergarh, Odisha - 769003 ","['0661-2642379', '08895269521']",ICSE
St. Mary's Convent School,Odisha,"St. Mary's Convent School,P. O. Sundargarh-770 033, Birmitrapur, Sundergarh, Odisha - 770033 ",['0661-2610357'],ICSE
St. Paul's School,Odisha,"St. Paul's School,Hamirpur Sundargarh-769 003, Rourkela, Sundergarh, Odisha - 769003 ","['0661-2642786', '0661-2647285']",ICSE
St. Thomas English School,Odisha,"St. Thomas English School,El-13 Basanti Colony Sundargarh-769 012, Rourkela, Sundergarh, Odisha - 769012 ",['0661-2481893'],ICSE
Primrose School,Puducherry,"Primrose School,63 Gundu Salai Pondicherry-605 010, Oulgaret, Puducherry - 605010 ","['0413-2290106', '0413-2292346']",ICSE
Gobind International Public School,Punjab,"Gobind International Public School,Road, Main Highway, Bhadaur, Barnala, Punjab - 148102 ",['www.gipsbhadaur.com'],ICSE
Saint Paul's High School,Punjab,"Saint Paul's High School,Street #9 Adarsh Nagar East, Goniana Road, Bathinda, Punjab - 151003 ",['0164-2760334'],ICSE
Baalak Yesu Convent School,Punjab,"Baalak Yesu Convent School,Village Phatak Majri P. O. Sadhugarh, Sirhind, Fatehgarh Sahib, Punjab - 140406 ",['01763266181'],ICSE
St. Joseph's School,Punjab,"St. Joseph's School,Chandigarh Road, Khamano, Fatehgarh Sahib, Punjab - 141127 ","['01628-631439', '09041128065']",ICSE
St. Roop Convent School,Punjab,"St. Roop Convent School,Patiala-Sirhind Road Near Nandpur Kesho Bus Stand Village, Mallanheri, Fatehgarh Sahib, Punjab - 147001 ",['roopconventschool.com/'],ICSE
Little Flower Convent School,Punjab,"Little Flower Convent School,Mohan Ke Road Ferozepur-152 022, Guruharsahai, Firozpur, Punjab ",[''],ICSE
Baring School,Punjab,"Baring School,Jalandhar Road, Batala, Gurdaspur, Punjab - 143505 ","['01871-226590', '01871-244088']",ICSE
Gagan International School,Punjab,"Gagan International School,Vp. O. Kalanaur Teh. & District, Gurdaspur, Punjab - 143530 ",[''],ICSE
Sant Baba Gurmukh Singh International School,Punjab,"Sant Baba Gurmukh Singh International School,Barkandi Road Muktsar Sahib Muktsar-152 026, Muktsar Sahib, Punjab - 152026 ",['01633-211313'],ICSE
Holy Family Convent School,Punjab,"Holy Family Convent School,Nangal Road, Ropar, Rupnagar, Punjab - 140001 ",['pu046cisce.org'],ICSE
Minerva Public School,Punjab,"Minerva Public School,P. O. Daon Tehsil Mohali, Ropar, Rupnagar, Punjab - 140301 ","['0172-2670063', '0172-2670273']",ICSE
Mount Carmel School,Punjab,"Mount Carmel School,Kristu Jayanti Nagar Village Dhahe P. O. Jindwari, Ropar, Rupnagar, Punjab - 140123 ",['01887-264001'],ICSE
Col. V. R. Mohan D. A. V. Public School,Punjab,"Col. V. R. Mohan D. A. V. Public School,Dera Bassi S. A. S. Nagar Sas Nagar-140 507, S.a.s. Nagar, Sahibzada Ajit Singh Nagar, Punjab ",['01762-282246'],ICSE
Holy Family Convent School,Punjab,"Holy Family Convent School,Nabha Sahib, Patiala Road, P. O. - Dayalpura, District T-S. A. S. Nagar Sas Nagar, Zirakpur, Sahibzada Ajit Singh Nagar, Punjab - 140603 ","['01762-287040', '9855908202']",ICSE
New Angel Public School,Punjab,"New Angel Public School,Saini Complex Patiala Road Sas Nagar-140 603, Zirakpur, Sahibzada Ajit Singh Nagar, Punjab - 140603 ","['09257236511', '01762-521487']",ICSE
Sawan International School,Punjab,"Sawan International School,Ambala-Chandigarh Highway, Lalru, Mohali, Sahibzada Ajit Singh Nagar, Punjab - 140501 ",['09988129343'],ICSE
St. Xavier's High School,Punjab,"St. Xavier's High School,Sector 71 S. A. S. Nagar Sas Nagar-160 071, S.a.s. Nagar, Sahibzada Ajit Singh Nagar, Punjab ","['0172-2227833', '0172-2266218']",ICSE
Yadavindra Public School,Punjab,"Yadavindra Public School,Sector 51 -160 062, Sas Nagar, Sahibzada Ajit Singh Nagar, Punjab ","['0172-2230781', '0172-2232850']",ICSE
Mount Carmel School,Punjab,"Mount Carmel School,Village Siana Nawanshahr, Balachaur, Shaheed Bhagat Singh Nagar, Punjab - 144521 ","['01885-222200', '01885-222100']",ICSE
Punjab International Public School,Punjab,"Punjab International Public School,Shivalik Hills G. T. B. State Highway Pojewal Nawanshahr, Tehsil Balachaur, Shaheed Bhagat Singh Nagar, Punjab ","['01885-244480', '01885-244481']",ICSE
Guru Gobind Singh Convent School,Punjab,"Guru Gobind Singh Convent School,Village Sohawa Post Office Sarhali Kalan, Tarn Taran, Punjab - 143410 ",['01852212878'],ICSE
Mai Bhago International Public School,Punjab,"Mai Bhago International Public School,Usma, Tarn Taran, Punjab - 143401 ","['09316400005', '09356649492']",ICSE
Punjab Children Academy,Punjab,"Punjab Children Academy,Near Goindwal Railway Crossing, Tarn Taran, Punjab - 143401 ","['01852-223157', '01852-223167']",ICSE
Sacred Heart Convent School,Punjab,"Sacred Heart Convent School,Takkarpura, Patti, Tarn Taran, Punjab ",['pu073cisce.org'],ICSE
Hillview Adventist School,Rajasthan,"Hillview Adventist School,Ramble Road, Ajmer, Rajasthan - 305006 ","['0145-2627895', '0145-2787290']",ICSE
Mayo College Girls' School,Rajasthan,"Mayo College Girls' School,Mayo Link Road, Ajmer, Rajasthan - 305008 ","['0145-2661286', '0145-5130286']",ICSE
St,Rajasthan,"St,Paul's School Ward #08 Village-Sakriya Udaipur Road, Nimbahera, Chittorgarh, Rajasthan - 312601 ",['01477-232459'],ICSE
Seventh Day Adventist Senior Secondary School,Rajasthan,"Seventh Day Adventist Senior Secondary School,4 Ml Suratgarh-Padampur Bypass Sri, Sri Ganganagar, Ganganagar, Rajasthan - 335001 ",['0154-2481774'],ICSE
Children Garden Play School,Rajasthan,"Children Garden Play School,Opposite Geejgarh House Keshav Nagar Hawa Sarak, Civil Lines, Jaipur, Rajasthan - 302006 ",['0141-2228574'],ICSE
Children's Academy,Rajasthan,"Children's Academy,Nirman Nagar, King's Road, Jaipur, Rajasthan - 302019 ","['0141-2812723', '0141-2812724']",ICSE
Children's Academy,Rajasthan,"Children's Academy,Todermal Marg Bani Park, Jaipur, Rajasthan - 302016 ","['0141-2201038', '0141-2203273']",ICSE
Mayura School,Rajasthan,"Mayura School,Naila Bagh Palace, Moti Dungri Road, Jaipur, Rajasthan - 302004 ",['0141-2601299'],ICSE
Saint Paul's School,Rajasthan,"Saint Paul's School,Station Road, Durgapura, Jaipur, Rajasthan - 302015 ",['0141-2550056'],ICSE
Springfield School,Rajasthan,"Springfield School,Kiran Path Sector 3, Manasarovar, Jaipur, Rajasthan - 302020 ","['0141-2392542', '0141-2392790']",ICSE
St. Mary's Senior Secondary School,Rajasthan,"St. Mary's Senior Secondary School,Near Circuit House, Jaipur Road, Sikar, Rajasthan - 332001 ",['stmaryschoolsikar.org/'],ICSE
Sophia High School,Rajasthan,"Sophia High School,Mount Abu, Sirohi, Rajasthan - 307501 ",['02974-238990'],ICSE
St. Mary's High School,Rajasthan,"St. Mary's High School,Mount Abu, Sirohi, Rajasthan - 307501 ",['02974-238894'],ICSE
St. Joseph's School,Sikkim,"St. Joseph's School,Martam P. O. Gankha, Via Singtam, East Sikkim, Sikkim - 737134 ",['03592-236837'],ICSE
St. Joseph's School,Sikkim,"St. Joseph's School,Rhenock P. O. Aritar Road, Kingston, East Sikkim, Sikkim - 737133 ","['03592-253064', '03592-253849']",ICSE
St. Xavier's School,Sikkim,"St. Xavier's School,P. O., Pakyong, East Sikkim, Sikkim - 737106 ","['03592-257792', '03592-257090']",ICSE
Tashi Namgyal Academy,Sikkim,"Tashi Namgyal Academy,P. O. Raj Bhawan, Gangtok, East Sikkim, Sikkim - 737103 ",['03592-202527'],ICSE
Namchi Public School,Sikkim,"Namchi Public School,Namchi, South Sikkim, Sikkim - 737126 ","['03595-263770', '03595-263887']",ICSE
St. Francis School,Sikkim,"St. Francis School,Jorethang, South Sikkim, Sikkim - 737121 ","['03595-257919', '9832564632']",ICSE
Don Bosco School,Sikkim,"Don Bosco School,P. O. Malbasey, West Sikkim, Sikkim - 737121 ",['03595-253215'],ICSE
St. Mary's Convent School,Sikkim,"St. Mary's Convent School,Geyzing, West Sikkim, Sikkim - 737111 ",['1991'],ICSE
Abacus Montessori School,Tamil nadu,"Abacus Montessori School,3 Thirumalai Nagar Annexe III Main Road, Perungudi, Chennai, Tamil Nadu - 600096 ","['044-24960904', '044-24963823']",ICSE
Chettinad Hari Shree Vidyalayam Nursery and Primary School,Tamil nadu,"Chettinad Hari Shree Vidyalayam Nursery and Primary School,20 Srinivasa Avenue Road Rajah Annamalaipuram, Chennai, Tamil Nadu - 600028 ","['044-24615254', '044-24615264']",ICSE
Doveton Boys' Higher Secondary School,Tamil nadu,"Doveton Boys' Higher Secondary School,#12 ( Old #1 ), Vepery, Chennai, Tamil Nadu - 600007 ","['044-25325619', '044-26610712']",ICSE
Doveton Girls' Higher Secondary School,Tamil nadu,"Doveton Girls' Higher Secondary School,#12 ( Old #1 ) Ritherdon Road, Vepery, Chennai, Tamil Nadu - 600007 ","['044-25325619', '044-26610712']",ICSE
Navadisha Montessori School,Tamil nadu,"Navadisha Montessori School,3rd Cross Street Kalki Nagar Near Ags Colony 6th Main Road, Velachery, Chennai, Tamil Nadu - 600042 ",['09677019347'],ICSE
Nps International Chennai,Tamil nadu,"Nps International Chennai,439 Cheran Nagar ( Adjacent To Global Hospitals ) Shollinganallur-Medavakkam Link Road, Chennai, Tamil Nadu - 600100 ","['044-28351974', '044-28351973']",ICSE
Primrose Schools,Tamil nadu,"Primrose Schools,1/367 East Coast Road Injambakkam Chennai-60 0115, Chennai, Tamil Nadu ","['044-24530247', '044-24530248']",ICSE
Seventh Day Adventist Higher Secondary School,Tamil nadu,"Seventh Day Adventist Higher Secondary School,16 Valliammal Road, Vepery, Chennai, Tamil Nadu - 600007 ",['044-26610660'],ICSE
Sishya,Tamil nadu,"Sishya,2/15 Padmanabha Nagar 2nd Street, Adyar, Chennai, Tamil Nadu - 600020 ",['044-24912652'],ICSE
St. Augustine School,Tamil nadu,"St. Augustine School,Rajaratnam 1st Street Narmadha Nagar, Ullagram, Chennai, Tamil Nadu - 600091 ","['044-22243478', '044-22424532']",ICSE
St. Michael's Academy,Tamil nadu,"St. Michael's Academy,#2 3rd Canal Cross Road 4th Main Road Chennai, Chennai, Tamil Nadu - 600020 ","['24915331', '24402181']",ICSE
St. Patrick's High School,Tamil nadu,"St. Patrick's High School,Gandhi Nagar, Adyar, Chennai, Tamil Nadu - 600020 ","['044-64503646', '044-24454792']",ICSE
The Ashram,Tamil nadu,"The Ashram,110 Velachery Road Guindy, Chennai, Tamil Nadu - 600032 ","['044-22355329', '044-65130426']",ICSE
The Grove School,Tamil nadu,"The Grove School,1 Eldams Road Alwarpet, Chennai, Tamil Nadu - 600018 ",['044-24355592'],ICSE
The School (krishnamurti Foundation India),Tamil nadu,"The School (krishnamurti Foundation India),Damodar Gardens Besant Avenue, Adyar, Chennai, Tamil Nadu - 600020 ",['044-24915845'],ICSE
Vaels International School,Tamil nadu,"Vaels International School,Pon Vidyashram Gardens Valmiki Street Injambakkam, Injambakkam, Ecr, Chennai, Tamil Nadu - 600115 ","['044-24492792', '044-24492892']",ICSE
Disha A Life School,Tamil nadu,"Disha A Life School,Kullakkapalayam Pirivu P. K. D. College Road, Pollachi, Coimbatore, Tamil Nadu - 642002 ","['04259-259161', '04259-259181']",ICSE
DR. Dasarathan International School,Tamil nadu,"DR. Dasarathan International School,#3/31, Thoppampatti Pirivu, Jangamanaicken Palayam, Mettupalayam Main Road, Vadamadurai Kurudampalayam, Coimbatore, Tamil Nadu ",['tn074cisce.org'],ICSE
Isha Home School,Tamil nadu,"Isha Home School,Velliangiri Foothills, Coimbatore, Tamil Nadu - 641114 ",['0422-2515444-8'],ICSE
Kaumaram Sushila International Residential School,Tamil nadu,"Kaumaram Sushila International Residential School,Chinnavedampatti, Coimbatore, Tamil Nadu - 641049 ",['0422-6505656'],ICSE
Nirmala Matha Convent School,Tamil nadu,"Nirmala Matha Convent School,Kuniamuthur Coimbatore, Coimbatore, Tamil Nadu - 641008 ",[''],ICSE
Samskaara Academy,Tamil nadu,"Samskaara Academy,Trichy Road Ondipudur Coimbatore, Coimbatore, Tamil Nadu - 641016 ","['04222272221', '9442146362']",ICSE
Stanes School,Tamil nadu,"Stanes School,Avinashi Road, Coimbatore, Tamil Nadu - 641018 ","['0422-2213952', '0422-2385656']",ICSE
Kodaikanal Public School,Tamil nadu,"Kodaikanal Public School,Post Box #46 M. M. Street, Kodaikanal, Dindigul, Tamil Nadu - 624101 ","['04542-240375', '04542-243121']",ICSE
The Unique Academy,Tamil nadu,"The Unique Academy,14/190 Perundurai R. S. Road, Ingur, Erode, Tamil Nadu - 638052 ","['04294-230998', '09976636369']",ICSE
Brindavan Public School,Tamil nadu,"Brindavan Public School,Athur P. O., Chengalpattu, Kanchipuram, Tamil Nadu - 603101 ",['04114-226403'],ICSE
