Name,Region,Address,Contact,Curriculum
City Montessori Inter College,Uttar pradesh,"City Montessori Inter College,Opposite Talkatora Police Station Sector-I, Rajajipuram, Lucknow, Uttar Pradesh - 226017 ","['0522-2416937', '0522-2414739']",ICSE
City Montessori Inter College,Uttar pradesh,"City Montessori Inter College,Sector O, Aliganj, Lucknow, Uttar Pradesh - 226024 ",['0522-2326882'],ICSE
City Montessori School,Uttar pradesh,"City Montessori School,Luknow, Indira Nagar, Lucknow, Uttar Pradesh - 226016 ",['0522-2351887'],ICSE
City Montessori School,Uttar pradesh,"City Montessori School,Sector D L. D. A. Colony, Kanpur Road, Lucknow, Uttar Pradesh - 226012 ","['0522-2435690', '0522-2435342']",ICSE
City Montessori School,Uttar pradesh,"City Montessori School,Anand Nagar, Jail Road, Lucknow, Uttar Pradesh - 226005 ","['0522-2455332', '0522-2232858']",ICSE
City Convent School,Uttar pradesh,"City Convent School,H. I. G. / C-1613, Rajajipuram, Lucknow, Uttar Pradesh - 226017 ","['0522-2410723', '0522-2418421']",ICSE
City Montessori School,Uttar pradesh,"City Montessori School,1/07 Vardan Khand Near Maqdoompur Police Chowki, Gomti Nagar Extension, Lucknow, Uttar Pradesh - 226010 ","['0522-2990608', '0522-2999586']",ICSE
La Martiniere College,Uttar pradesh,"La Martiniere College,Luknow, Lucknow, Uttar Pradesh - 226001 ",['0522-2235415'],ICSE
La Martiniere Girls College,Uttar pradesh,"La Martiniere Girls College,Post Box 33, Lucknow, Uttar Pradesh - 226001 ","['0522-3265624', '0522-3265625']",ICSE
Loreto Convent Intermediate College,Uttar pradesh,"Loreto Convent Intermediate College,M. G. Road, M.g. Road, Lucknow, Uttar Pradesh - 226001 ",['0522-2237222'],ICSE
St. Francis' College,Uttar pradesh,"St. Francis' College,Shahnajaf Road Hazratganj, Lucknow, Uttar Pradesh - 226001 ",['0522-2623712'],ICSE
St. Mary's Convent Inter College,Uttar pradesh,"St. Mary's Convent Inter College,Rdso, Manak Nagar, Lucknow, Uttar Pradesh - 226011 ","['0522-2450530', '0522-2455448']",ICSE
St. Paul's College,Uttar pradesh,"St. Paul's College,10 Subhash Marg P. O. Dilkusha, Lucknow, Uttar Pradesh - 226002 ","['0522-2480624', '0522-2483228']",ICSE
Colvin Taluqdars College,Uttar pradesh,"Colvin Taluqdars College,University Road, Lucknow, Uttar Pradesh - 226007 ","['0522-2782404', '0522-2782669']",ICSE
St. Fidelis College,Uttar pradesh,"St. Fidelis College,Vishnupuri Church Road, Aliganj, Lucknow, Uttar Pradesh - 226022 ","['0522-2321078', '0522-6591435']",ICSE
Spring Dale College,Uttar pradesh,"Spring Dale College,A Block-1224, Indira Nagar, Lucknow, Uttar Pradesh - 226016 ","['0522-2341276', '0522-2348756']",ICSE
St. Thomas College,Uttar pradesh,"St. Thomas College,Sarojini Nagar, Lucknow, Uttar Pradesh - 226008 ",['0522-2436715'],ICSE
Hoerner College,Uttar pradesh,"Hoerner College,Mahanagar Extension, Lucknow, Uttar Pradesh - 226006 ","['0522-2324119', '0522-2371653']",ICSE
Spring Dale College,Uttar pradesh,"Spring Dale College,Sector-G L. D. A. Colony, Kanpur Road, Lucknow, Uttar Pradesh - 226016 ",['0522-2424743'],ICSE
Dabble College,Uttar pradesh,"Dabble College,Sector 15, Indira Nagar, Lucknow, Uttar Pradesh - 226016 ","['0522-2346148', '0522-2358270']",ICSE
Unity College,Uttar pradesh,"Unity College,Hussainabad P. O. Box 6, Lucknow, Uttar Pradesh - 226003 ","['0522-2254009', '0522-2257572']",ICSE
Lucknow Public College,Uttar pradesh,"Lucknow Public College,' A ' - Block, Rajajipuram, Lucknow, Uttar Pradesh - 226017 ","['0522-6537816', '0522-661195']",ICSE
St. Teresa's College,Uttar pradesh,"St. Teresa's College,Sector L L. D. A. Colony Near Khazana, Aashiana, Lucknow, Uttar Pradesh - 226012 ",['0522-2423027'],ICSE
St. Mary's Inter College,Uttar pradesh,"St. Mary's Inter College,D-Block, Indira Nagar, Lucknow, Uttar Pradesh - 226016 ",['0522-2351440'],ICSE
Nirmala Convent Inter College,Uttar pradesh,"Nirmala Convent Inter College,Bahadurpur Kursi Road, Vikas Nagar, Lucknow, Uttar Pradesh - 226022 ",['0522-2960564'],ICSE
King George College,Uttar pradesh,"King George College,Sector 8 Indira Nagar, Faizabad Road, Lucknow, Uttar Pradesh - 226016 ",['0522-2701343'],ICSE
Lucknow Public College,Uttar pradesh,"Lucknow Public College,Sahara States, Jankipuram, Lucknow, Uttar Pradesh - 226021 ","['0522-2735441', '0522-6531758']",ICSE
New Public College,Uttar pradesh,"New Public College,Deputy Ganj Neelmatha, Lucknow, Uttar Pradesh - 226002 ","['0522-3273211', '0522-2454511']",ICSE
Sarvangin Vikas Public College,Uttar pradesh,"Sarvangin Vikas Public College,Kharika Telibagh, Lucknow, Uttar Pradesh - 226005 ",['0522-2472053'],ICSE
St. Joseph Inter College,Uttar pradesh,"St. Joseph Inter College,Thakurganj Hardoi Road, Lucknow, Uttar Pradesh - 226017 ","['0522-3202333', '0522-3297380']",ICSE
Immaculate Conception Convent School,Uttar pradesh,"Immaculate Conception Convent School,Vineet Khand-6 Gomtinagar, Lucknow, Uttar Pradesh - 226010 ",['0522-6590974'],ICSE
Jeevan Dhara Convent School,Uttar pradesh,"Jeevan Dhara Convent School,Gaura Bagh, Kursi Road, Lucknow, Uttar Pradesh ",['0522-2361577'],ICSE
Tiny Tots Convent School,Uttar pradesh,"Tiny Tots Convent School,C-42 Sector M Kursi Road, Aliganj, Lucknow, Uttar Pradesh - 226024 ",['0522-2334147'],ICSE
St. Xavier's Convent School,Uttar pradesh,"St. Xavier's Convent School,Vineet Khand-II Gomti Nagar, Lucknow, Uttar Pradesh - 226010 ","['0522-2727273', '0522-2727274']",ICSE
St. Teresa's Day School,Uttar pradesh,"St. Teresa's Day School,109/4 Model House Area, Tarak Mukerji Road, Lucknow, Uttar Pradesh - 226001 ","['0522-6560756', '0522-2423027']",ICSE
St. Dominic Savio School,Uttar pradesh,"St. Dominic Savio School,Indira Nagar, Lucknow, Uttar Pradesh - 226016 ","['0522-2352525', '8009140621']",ICSE
DR. Virendra Swarup Public School,Uttar pradesh,"DR. Virendra Swarup Public School,Sector C, Mahanagar, Lucknow, Uttar Pradesh - 226006 ",['0522-2370988'],ICSE
Emma Thompson School,Uttar pradesh,"Emma Thompson School,Lalbagh, Lucknow, Uttar Pradesh - 226001 ","['0522-2620008', '0522-2618262']",ICSE
Exon Montessori School,Uttar pradesh,"Exon Montessori School,Opposite Thana Bazar Khala, Tulsi Das Marg, Lucknow, Uttar Pradesh - 226003 ",['9956291437'],ICSE
Green Fields School,Uttar pradesh,"Green Fields School,New ' C ' Block, Rajajipuram, Lucknow, Uttar Pradesh - 226017 ","['0522-2410662', '0522-3246575']",ICSE
St. Thomas Mission High School,Uttar pradesh,"St. Thomas Mission High School,Sitapur Road Scheme Sector ' H ', Jankipuram, Lucknow, Uttar Pradesh - 226021 ","['0522-2730179', '0522-2732024']",ICSE
Scholars' Home,Uttar pradesh,"Scholars' Home,Vipul Khand III, Gomti Nagar, Lucknow, Uttar Pradesh - 226010 ","['0522-2398844', '0522-4000044']",ICSE
Modern Indian School,Uttar pradesh,"Modern Indian School,Kothari Bandhu Marg Sector 13 C-Block M. I. S. Chauraha, Rajajipuram, Lucknow, Uttar Pradesh - 226017 ",['0522-2414977'],ICSE
Seth M.R. Jaipuria School,Uttar pradesh,"Seth M.R. Jaipuria School,Vineet Khand, Gomti Nagar, Lucknow, Uttar Pradesh - 226010 ","['0522-2301301', '0522-2391660']",ICSE
St. James Mission School,Uttar pradesh,"St. James Mission School,E-Block Rajajipuram Avas-Vikas Colony, Avas , Lucknow, Uttar Pradesh - 226017 ",['0522-2416650'],ICSE
St. Joseph Montessori School,Uttar pradesh,"St. Joseph Montessori School,Sector 6 C-Block, Rajajipuram, Lucknow, Uttar Pradesh - 226017 ","['0522-2416973', '0522-3238559']",ICSE
Stella Maris School,Uttar pradesh,"Stella Maris School,Sector - H, L.D.A. Colony, Kanpur Road, Lucknow, Uttar Pradesh - 226012 ",['1992'],ICSE
St. Mary's School,Uttar pradesh,"St. Mary's School,Para Road, Rajajipuram, Lucknow, Uttar Pradesh - 226017 ","['0522-2416684', '0522-3295043']",ICSE
New Public School,Uttar pradesh,"New Public School,Devpur Rajajipuram, Lucknow, Uttar Pradesh - 226017 ",['0522-6550256'],ICSE
The Presidency Public School,Uttar pradesh,"The Presidency Public School,Adil Nagar Kalyanpur ( West ), Lucknow, Uttar Pradesh - 226022 ",['0522-3262959'],ICSE
Siddhartha Public School,Uttar pradesh,"Siddhartha Public School,Adarsh Vihar Near Buddheshwar Temple Ring Road Lucknow, Lucknow, Uttar Pradesh - 226003 ",[''],ICSE
Holy Cross School,Uttar pradesh,"Holy Cross School,P. O., Nautanwa, Maharajganj, Uttar Pradesh - 273164 ",['05522-234427'],ICSE
Little Flower School,Uttar pradesh,"Little Flower School,Dhaneie, Police Lines, Maharajganj, Maharajganj, Uttar Pradesh - 273303 ",['www.littleflowermrj.in/'],ICSE
St. Thomas School,Uttar pradesh,"St. Thomas School,Civil Lines, Mainpuri, Uttar Pradesh - 205001 ","['05672-231098', '05672-234889']",ICSE
Bhaktivedanta Gurukula and International School,Uttar pradesh,"Bhaktivedanta Gurukula and International School,Bhaktivedanta Marg Raman Reti, Vrindavan, Mathura, Uttar Pradesh - 281121 ",['www.bgis.org/'],ICSE
Grace Convent Senior Secondary School,Uttar pradesh,"Grace Convent Senior Secondary School,23 A-B, Krishna Nagar, Mathura, Uttar Pradesh - 281004 ","['0565-2422340', '0565-2421039']",ICSE
Mayor School,Uttar pradesh,"Mayor School,Sonkh Road, Mathura, Uttar Pradesh - 281004 ","['0565-2421484', '0565-6451155']",ICSE
Sacred Heart Convent Higher Secondary School,Uttar pradesh,"Sacred Heart Convent Higher Secondary School,Moti Kunj Dholipiau, Mathura, Uttar Pradesh - 281002 ",['0565-3205442'],ICSE
St. Francis School,Uttar pradesh,"St. Francis School,Village Navada Adukki P. O, Mathura, Uttar Pradesh - 281006 ",['0565-2432694'],ICSE
Central Academy,Uttar pradesh,"Central Academy,Mata Pokhra, Mau Nath Bhanjan, Mau, Uttar Pradesh - 275101 ",['0547-2224736'],ICSE
Fatima School,Uttar pradesh,"Fatima School,Tajopur, Mau, Uttar Pradesh - 275101 ",['0547-2860098'],ICSE
ALL Saints School,Uttar pradesh,"ALL Saints School,Mission Compound Near Baccha Park, Thapar Nagar Road, Meerut, Uttar Pradesh - 250001 ",['0121-4035802'],ICSE
Sophia Girls' School,Uttar pradesh,"Sophia Girls' School,Bank Street Cantt, Meerut Cantt., Meerut, Uttar Pradesh - 250001 ",['0121-2645445'],ICSE
St. Francis Convent School,Uttar pradesh,"St. Francis Convent School,Kankherkhera Shantinagar, Sardhana Road, Meerut, Uttar Pradesh - 250001 ",['0121-2630770'],ICSE
St. James' School,Uttar pradesh,"St. James' School,42 Subhash Puri Church Compound, Kanker Khera, Meerut, Uttar Pradesh - 250001 ",['0121-2556560'],ICSE
St. Mary's Academy,Uttar pradesh,"St. Mary's Academy,Cariappa Street Cantt, Meerut Cantt., Meerut, Uttar Pradesh - 250001 ",['0121-2640838'],ICSE
St. Thomas' English Medium School,Uttar pradesh,"St. Thomas' English Medium School,Jyoti Niketan, Chippi Tank, Meerut, Uttar Pradesh - 250001 ","['0121-2641598', '0121-2547854']",ICSE
Seth Dwarka Prasad Bajaj Education Center,Uttar pradesh,"Seth Dwarka Prasad Bajaj Education Center,Vindhyachal Road, Meerjapur, Mirzapur, Uttar Pradesh - 231001 ",['05442-242086'],ICSE
St. Mary's School,Uttar pradesh,"St. Mary's School,Peeli Kothi, Station Road, Mirzapur, Uttar Pradesh - 231001 ",['05442-220022'],ICSE
Holy Suffah Public School,Uttar pradesh,"Holy Suffah Public School,Hasan Pur Road, Sambhal, Moradabad, Uttar Pradesh - 244302 ",['05923233425'],ICSE
Maharaja Agarsen Public School,Uttar pradesh,"Maharaja Agarsen Public School,Mandi Bans, Moradabad, Uttar Pradesh - 244001 ","['0591-2472899', '0591-2472346']",ICSE
Rajendra's Nosegay School,Uttar pradesh,"Rajendra's Nosegay School,Madhubani Colony Haridwar Road Moradabad, Moradabad, Uttar Pradesh - 244001 ",['0591-2451201'],ICSE
Sacred Heart Convent School,Uttar pradesh,"Sacred Heart Convent School,Dewarkhera, Chandausi, Moradabad, Uttar Pradesh ","['05921-251278', '05921-253448']",ICSE
Springfields College,Uttar pradesh,"Springfields College,Delhi Road, Majhola, Moradabad, Uttar Pradesh - 244001 ","['0591-2482778', '0591-2481724']",ICSE
St. Amtul Public School,Uttar pradesh,"St. Amtul Public School,Wajid Puram Road, Sambhal, Moradabad, Uttar Pradesh - 244302 ",['05923-224601'],ICSE
St. Paul's College,Uttar pradesh,"St. Paul's College,Near Syndicate Bank, Civil Lines, Moradabad, Uttar Pradesh - 244001 ",['1972'],ICSE
The G.K. Welhams College,Uttar pradesh,"The G.K. Welhams College,2 Azad Nagar, Railway Harthala Colony, Moradabad, Uttar Pradesh - 244001 ",['0591-2431555'],ICSE
Tiny Tots College,Uttar pradesh,"Tiny Tots College,26 Civil Lines, Moradabad, Uttar Pradesh - 244001 ",['0591-2417898'],ICSE
Wilsonia College,Uttar pradesh,"Wilsonia College,Civil Lines Post Box #211, Moradabad, Uttar Pradesh - 244001 ","['0591-2414734', '0591-2415251']",ICSE
St. Francis School,Uttar pradesh,"St. Francis School,Kairana Road P. O. & District, Shamli, Muzaffarnagar, Uttar Pradesh - 247776 ","['01398-250725', '01398-250760']",ICSE
St. Thomas School,Uttar pradesh,"St. Thomas School,G. T. Road Near Mittal Petrol Pump, Khatauli, Muzaffarnagar, Uttar Pradesh - 251201 ",['01396-275753'],ICSE
New Vision School,Uttar pradesh,"New Vision School,Near Railway Goods Shed, Raebareli, Uttar Pradesh - 229001 ",['0535-2212993'],ICSE
Ryan International School,Uttar pradesh,"Ryan International School,Rahi Village Sultanpur Road, Raebareli, Uttar Pradesh - 229001 ",['0535-2701275'],ICSE
St. James School,Uttar pradesh,"St. James School,Civil Lines Gora Bazar, Raebareli, Uttar Pradesh - 229001 ",['0535-2701440'],ICSE
St. Peter's School,Uttar pradesh,"St. Peter's School,Chhajlapur P. O. I. T. I, Raebareli, Uttar Pradesh - 229010 ",['0535-2701494'],ICSE
Sai Girls Public School,Uttar pradesh,"Sai Girls Public School,130 Krishna Vihar Jwalanagar, Rampur, Uttar Pradesh - 244901 ",['0595-2330987'],ICSE
Infant Jesus School,Uttar pradesh,"Infant Jesus School,A. R. T. O. Township, A.r.t.o. Township, Saharanpur, Uttar Pradesh - 247001 ","['0132-2724544', '0132-2711704']",ICSE
Saharanpur Public School,Uttar pradesh,"Saharanpur Public School,Paper Mills Road, Saharanpur, Uttar Pradesh - 247001 ","['0132-3290511', '0132-2727028']",ICSE
St. Thomas' School,Uttar pradesh,"St. Thomas' School,P. O., Khalilabad, Sant Kabir Nagar, Uttar Pradesh - 272175 ","['09235990061', '09935110437']",ICSE
St. Mary's School,Uttar pradesh,"St. Mary's School,P. O. Nai Bazar, Bhadohi, Sant Ravidas Nagar, Uttar Pradesh - 221409 ",['05414-278635'],ICSE
St. Thomas' School,Uttar pradesh,"St. Thomas' School,P. O., Gopiganj, Sant Ravidas Nagar, Uttar Pradesh - 221303 ","['05415-233685', '05414-232397']",ICSE
Don & Donna Convent,Uttar pradesh,"Don & Donna Convent,81 Jhanda Kalan, Shahjahanpur, Uttar Pradesh - 242001 ","['09307237680', '09936611322']",ICSE
Holy Angels' School,Uttar pradesh,"Holy Angels' School,Chinour P. O. Paina, Shahjahanpur, Uttar Pradesh - 242001 ",['05842-228094'],ICSE
John Nave Senior Secondary School,Uttar pradesh,"John Nave Senior Secondary School,Lodhipur, Shahjahanpur, Uttar Pradesh - 242001 ","['05842-222175', '05842-228696']",ICSE
St. Xavier's School,Uttar pradesh,"St. Xavier's School,Sanfrancis Nagar Tetari Bazar P. O. Siddharth Nagar, P.o. Siddharth Nagar, Siddharthnagar, Uttar Pradesh - 272207 ",['05544-222269'],ICSE
Don Bosco High School,Uttar pradesh,"Don Bosco High School,P. O., Mahmudabad, Sitapur, Uttar Pradesh - 261203 ",['donbosco1.hpage.com/'],ICSE
Regency Public School,Uttar pradesh,"Regency Public School,64, Station Road, Sitapur, Sitapur, Uttar Pradesh - 261001 ",['regencypublicschool.com/'],ICSE
Senior's Radiant Academy,Uttar pradesh,"Senior's Radiant Academy,Karmasepur Mishrikh, Sitapur, Uttar Pradesh - 261401 ",['09305835461'],ICSE
D. C. Lewis Memorial School,Uttar pradesh,"D. C. Lewis Memorial School,Hi-Tech Road Murdhwa, Renukoot, Sonbhadra, Uttar Pradesh - 231217 ",['05446-253523'],ICSE
Christ The King School,Uttar pradesh,"Christ The King School,Road #2 U. P. S. I. D. C. Industrial Area, Jagadishpur, Sultanpur, Uttar Pradesh - 227817 ",['05361-270732'],ICSE
Gurucharan Kaur Public School,Uttar pradesh,"Gurucharan Kaur Public School,Civil Lines, Sultanpur, Uttar Pradesh - 228001 ","['05362-221190', '09415136366']",ICSE
Dr. Virendra Swarup Education Centre,Uttar pradesh,"Dr. Virendra Swarup Education Centre,Kundan Road Unnao, Unnao, Uttar Pradesh - 209801 ","['0512-2641352', '0512-2641353']",ICSE
Shri Jagannath Shah Memorial Public School,Uttar pradesh,"Shri Jagannath Shah Memorial Public School,( Near S. P. Office ), Civil Lines, Unnao, Uttar Pradesh - 209801 ","['0515-2827282', '0515-9307016991']",ICSE
Sir Syed Public School,Uttar pradesh,"Sir Syed Public School,Priyadarshini Nagar Near Achal Ganj Byepass, Unnao, Uttar Pradesh - 209801 ","['0515-2823690', '0515-2823691']",ICSE
St. Jude's College,Uttar pradesh,"St. Jude's College,Pitamber Nagar, Unnao, Uttar Pradesh - 209801 ","['0515-2820793', '0515-2820744']",ICSE
St. Lawrence School,Uttar pradesh,"St. Lawrence School,Priyadarshini Nagar, Raebareli Road, Unnao, Uttar Pradesh - 209801 ",['0515-2823571'],ICSE
Bal Bharatiya English School,Uttar pradesh,"Bal Bharatiya English School,Narharpur, Lohatiya- ausanganj road, Varanasi, Uttar Pradesh - 221001 ","['0542-2214229', '09307095590']",ICSE
Bal Bharti Public School,Uttar pradesh,"Bal Bharti Public School,K-66/12, Nawab Ki Dheori, Varanasi, Uttar Pradesh - 221001 ","['0542-2213932', '0542-2214808']",ICSE
R. K. P. Yash Public School,Uttar pradesh,"R. K. P. Yash Public School,Parashurampur Sarnath Varanasi, Varanasi, Uttar Pradesh - 221006 ",['0542-2220991'],ICSE
Silver Grove School,Uttar pradesh,"Silver Grove School,Maheshpur Lahartara Near T. C. I, Varanasi, Uttar Pradesh - 221106 ",['0542-2370920'],ICSE
St. Francis School,Uttar pradesh,"St. Francis School,Ramnagar, Varanasi, Uttar Pradesh - 221008 ",['0542-2668516'],ICSE
St. John's School,Uttar pradesh,"St. John's School,Diesel Locomotive Works, Varanasi, Uttar Pradesh - 221004 ","['0542-2270681', '0542-2270668']",ICSE
St. John's School,Uttar pradesh,"St. John's School,Marhauli, Bhoolanpur, Varanasi, Uttar Pradesh - 221104 ",['0542-2370387'],ICSE
St. John's School,Uttar pradesh,"St. John's School,Ledhupur Ashapur Sarnath Post, Varanasi, Uttar Pradesh - 221007 ","['0542-2591333', '0542-2591259']",ICSE
St. Joseph's Convent School,Uttar pradesh,"St. Joseph's Convent School,Shivpur, Varanasi, Uttar Pradesh - 221003 ",['0542-2282234'],ICSE
St. Stephen's School,Uttar pradesh,"St. Stephen's School,M. G. Road Sahityanaka, Ramnagar, Varanasi, Uttar Pradesh - 221008 ","['0542-2668099', '9307239295']",ICSE
William Henry Smith Memorial School,Uttar pradesh,"William Henry Smith Memorial School,D-59/108, Sigra, Varanasi, Uttar Pradesh - 221001 ",['0542-2221439'],ICSE
Ashok Hall Girls' Residential School,Uttarakhand,"Ashok Hall Girls' Residential School,P. O. Majkhali, Almora, Uttarakhand - 263652 ",['05966-240449'],ICSE
Koormanchal Academy,Uttarakhand,"Koormanchal Academy,Pokhar Khali, Almora, Uttarakhand - 263601 ","['05962-233038', '05962-234855']",ICSE
Jyoti Vidyalaya,Uttarakhand,"Jyoti Vidyalaya,Badrinath Road Joshinath, Joshimath, Chamoli, Uttarakhand - 246443 ",['01389-222220'],ICSE
Mount Carmel School,Uttarakhand,"Mount Carmel School,Dudhpokhra P. O., Kaflang, Champawat, Uttarakhand - 262523 ",['05965-211147'],ICSE
Agape Mission School,Uttarakhand,"Agape Mission School,Gumaniwala By-Pass Road Shyampur, Rishikesh, Dehradun, Uttarakhand - 249204 ",['0135-2452515'],ICSE
ANN Mary School,Uttarakhand,"ANN Mary School,General Mahadeo Singh Road, Dehra Dun, Dehradun, Uttarakhand - 248001 ",['0135-2762923'],ICSE
Bala Hissar Academy,Uttarakhand,"Bala Hissar Academy,5 Municipal Road, Dehra Dun, Dehradun, Uttarakhand - 248001 ",['0135-2657200'],ICSE
Brightlands School,Uttarakhand,"Brightlands School,1 Dick Road, Dalanwala, Dehradun, Uttarakhand - 248001 ","['0135-2656157', '0135-2650537']",ICSE
Brooklyn School,Uttarakhand,"Brooklyn School,3/1 Curzon Road, Dalanwala, Dehradun, Uttarakhand - 248001 ",['0135-2651805'],ICSE
Cambrian Hall,Uttarakhand,"Cambrian Hall,13 Young Road Dehra Dun Cantt, Dehra Dun Cantt., Dehradun, Uttarakhand - 248003 ",['0135-2753589'],ICSE
Carman Res. and Day School,Uttarakhand,"Carman Res. and Day School,24 Nehru Road, Dalanwala, Dehradun, Uttarakhand - 248001 ",['0135-2657661'],ICSE
Carman Res. and Day School,Uttarakhand,"Carman Res. and Day School,Shyampur, Prem Nagar, Dehradun, Uttarakhand - 248007 ","['0135-2773381', '0135-2773383']",ICSE
Col. Brown Cambridge School,Uttarakhand,"Col. Brown Cambridge School,5 Kasturba Road P. O. Box #31, Dehra Dun, Dehradun, Uttarakhand - 248001 ","['0135-2655233', '0135-2712228']",ICSE
Constancia School,Uttarakhand,"Constancia School,P. O. Majra, Saharanpur Road, Dehradun, Uttarakhand - 248179 ","['0135-2640177', '0135-2642360']",ICSE
Convent of Jesus and Mary,Uttarakhand,"Convent of Jesus and Mary,Hamption Court, Mussoorie, Dehradun, Uttarakhand - 248179 ","['0135-2632530', '0135-5535399']",ICSE
Convent of Jesus and Mary High School,Uttarakhand,"Convent of Jesus and Mary High School,16 Convent Road, Dehra Dun, Dehradun, Uttarakhand - 248001 ","['0135-2651390', '0135-2713560']",ICSE
Dehradun Public School,Uttarakhand,"Dehradun Public School,Village Kandoli P. O. Bidholi Via Premnagar, Dehra Dun, Dehradun, Uttarakhand - 248007 ","['0135-3208688', '0135-3294833']",ICSE
Dehradun World School,Uttarakhand,"Dehradun World School,Bagicha Road Nathuawala Dehradun, Dehradun, Uttarakhand - 248008 ","['01352112548', '01352781749']",ICSE
Doon Blossoms School,Uttarakhand,"Doon Blossoms School,#7 Uggar Road Dalanwala, Dehra Dun, Dehradun, Uttarakhand - 248001 ","['0135-2655496', '0135-2650393']",ICSE
Doon Cambridge School,Uttarakhand,"Doon Cambridge School,20 E Race Course, Dehra Dun, Dehradun, Uttarakhand - 248001 ",['0135-2635646'],ICSE
Doon Presidency School,Uttarakhand,"Doon Presidency School,2-B Premnagar, Dehra Dun, Dehradun, Uttarakhand - 248007 ","['0135-2771324', '0135-2773216']",ICSE
Doon Public School,Uttarakhand,"Doon Public School,Bhaniyawala -Rishikesh Road, Dehradun , Dehradun, Uttarakhand - 248144 ","['0135-2412986', '0135-2412073']",ICSE
Doon Valley Public School,Uttarakhand,"Doon Valley Public School,Village Johri P. O. Sinola, Dehra Dun, Dehradun, Uttarakhand - 248003 ",['0135-2735984'],ICSE
Flower Dale School,Uttarakhand,"Flower Dale School,53-A Tapkeshwar Road Garhi Cantt, Garhi Cantt., Dehradun, Uttarakhand - 248003 ",['0135-2552639'],ICSE
New Doon Blossoms School,Uttarakhand,"New Doon Blossoms School,Chak Danda Lakhond, Dehradun, Uttarakhand - 248001 ",['0135-2650393'],ICSE
The Mussoorie Girls & Boys School,Uttarakhand,"The Mussoorie Girls & Boys School,Camel's Back Road, Mussoorie, Dehradun, Uttarakhand - 248179 ","['0135-2632416', '0135-2631051']",ICSE
Brightlands School,Uttarakhand,"Brightlands School,1 Dick Road, Dalanwala, Dehradun, Uttarakhand - 248001 ","['0135-2656157', '0135-2650537']",ICSE
Brooklyn School,Uttarakhand,"Brooklyn School,3/1 Curzon Road, Dalanwala, Dehradun, Uttarakhand - 248001 ",['0135-2651805'],ICSE
Col. Brown Cambridge School,Uttarakhand,"Col. Brown Cambridge School,5 Kasturba Road P. O. Box #31, Dehra Dun, Dehradun, Uttarakhand - 248001 ","['0135-2655233', '0135-2712228']",ICSE
Cambrian Hall,Uttarakhand,"Cambrian Hall,13 Young Road Dehra Dun Cantt, Dehra Dun Cantt., Dehradun, Uttarakhand - 248003 ",['0135-2753589'],ICSE
Doon Cambridge School,Uttarakhand,"Doon Cambridge School,20 E Race Course, Dehra Dun, Dehradun, Uttarakhand - 248001 ",['0135-2635646'],ICSE
The Indian Cambridge School,Uttarakhand,"The Indian Cambridge School,12 Chander Road, Dalanwala, Dehradun, Uttarakhand - 248001 ",['0135-2654145'],ICSE
Kay Cee Public School,Uttarakhand,"Kay Cee Public School,Shashi Vihar, Govind Garh, Dehradun, Uttarakhand - 248001 ",['0135-2530841'],ICSE
Shri Ram Centennial School,Uttarakhand,"Shri Ram Centennial School,Village Sherpur Shimla Bypass Road Dehradun, Dehradun, Uttarakhand - 248197 ",[''],ICSE
St. Thomas' College,Uttarakhand,"St. Thomas' College,2 Cross Road, Dehra Dun, Dehradun, Uttarakhand - 248001 ","['0135-2654374', '0135-2710743']",ICSE
St. George's College,Uttarakhand,"St. George's College,P. O. Barlowganj, Mussoorie, Dehradun, Uttarakhand - 248122 ","['0135-2635433', '0135-2632591']",ICSE
Constancia School,Uttarakhand,"Constancia School,P. O. Majra, Saharanpur Road, Dehradun, Uttarakhand - 248179 ","['0135-2640177', '0135-2642360']",ICSE
G. R. D. World School,Uttarakhand,"G. R. D. World School,Bhagwanpur Julo Bhauwala, Dehra Dun, Dehradun, Uttarakhand - 248007 ",['0135-6992732'],ICSE
Flower Dale School,Uttarakhand,"Flower Dale School,53-A Tapkeshwar Road Garhi Cantt, Garhi Cantt., Dehradun, Uttarakhand - 248003 ",['0135-2552639'],ICSE
Dehradun Public School,Uttarakhand,"Dehradun Public School,Village Kandoli P. O. Bidholi Via Premnagar, Dehra Dun, Dehradun, Uttarakhand - 248007 ","['0135-3208688', '0135-3294833']",ICSE
Dehradun World School,Uttarakhand,"Dehradun World School,Bagicha Road Nathuawala Dehradun, Dehradun, Uttarakhand - 248008 ","['01352112548', '01352781749']",ICSE
Doon Presidency School,Uttarakhand,"Doon Presidency School,2-B Premnagar, Dehra Dun, Dehradun, Uttarakhand - 248007 ","['0135-2771324', '0135-2773216']",ICSE
Doon Public School,Uttarakhand,"Doon Public School,Bhaniyawala -Rishikesh Road, Dehradun , Dehradun, Uttarakhand - 248144 ","['0135-2412986', '0135-2412073']",ICSE
Doon Valley Public School,Uttarakhand,"Doon Valley Public School,Village Johri P. O. Sinola, Dehra Dun, Dehradun, Uttarakhand - 248003 ",['0135-2735984'],ICSE
Welham Girls' School,Uttarakhand,"Welham Girls' School,19 Municipal Road, Dalanwala, Dehradun, Uttarakhand - 248001 ","['0135-2654293', '0135-2654754']",ICSE
Hopetown Girls' School,Uttarakhand,"Hopetown Girls' School,Rajawala Road ( Off Chakrata Road ) 19th Milestone, Dehradun, Uttarakhand - 248197 ","['01352698022-23', '0135-52698554']",ICSE
Pine Hall School,Uttarakhand,"Pine Hall School,28 Rajpur Road, Dehra Dun, Dehradun, Uttarakhand - 248001 ","['0135-2742232', '0135-2749115']",ICSE
The Heritage School,Uttarakhand,"The Heritage School,14/6 New Road, Dehra Dun, Dehradun, Uttarakhand - 248001 ",['0135-2656155'],ICSE
Hilton's School,Uttarakhand,"Hilton's School,Bright Land's Estate P. O. Majra, Dehra Dun, Dehradun, Uttarakhand - 248179 ",['0135-2640240'],ICSE
